<?xml version="1.0" encoding="UTF-8"?>


<!-- Generated by Elektra API. Total of 20 keys. -->



<keyset parent="system/network"
        xmlns="http://elektra.sourceforge.net"
        xmlns:xsi="http://www.w3.org/2001/XMLSchema-instance"
        xsi:schemaLocation="http://elektra.sourceforge.net elektra.xsd">


<key basename="hostname"
     type="string" mode="0664">

     <value><![CDATA[example.domain.com]]></value>
     <comment><![CDATA[The fully qualified host name]]></comment>
</key>





<key basename="interfaces"
     type="directory" mode="0775">
</key>





<key basename="interfaces/LoopBack"
     type="directory" mode="0775">
</key>





<key basename="interfaces/LoopBack/broadcast"
     type="string" mode="0664">

     <value><![CDATA[127.255.255.255]]></value>
     <comment><![CDATA[If you're having problems with gated making 127.0.0.0/8 a martian, you can change this to something else (255.255.255.255, for example).
]]></comment>
</key>





<key basename="interfaces/LoopBack/device"
     type="string" mode="0664">

     <value><![CDATA[lo]]></value>
</key>





<key basename="interfaces/LoopBack/ip"
     type="string" mode="0664">

     <value><![CDATA[127.0.0.1]]></value>
     <comment><![CDATA[The fixed IP address of this interface.]]></comment>
</key>





<key basename="interfaces/LoopBack/netmask"
     type="string" mode="0664">

     <value><![CDATA[255.0.0.0]]></value>
</key>





<key basename="interfaces/LoopBack/onboot"
     type="string" mode="0664">

     <value><![CDATA[1]]></value>
     <comment><![CDATA[1 for automatic activation on boot
0 for only manual]]></comment>
</key>





<key basename="interfaces/SymbolicName1"
     type="directory" mode="0775">
</key>





<key basename="interfaces/SymbolicName1/HWaddress"
     type="string" mode="0664">

     <value><![CDATA[00:0D:60:12:A8:C6]]></value>
     <comment><![CDATA[The MAC address of this network interface]]></comment>
</key>





<key basename="interfaces/SymbolicName1/bootproto"
     type="string" mode="0664">

     <value><![CDATA[dhcp]]></value>
     <comment><![CDATA[The protocol type to be used to configure this interface. DHCP, BOOTP or static.]]></comment>
</key>





<key basename="interfaces/SymbolicName1/device"
     type="string" mode="0664">

     <value><![CDATA[eth0]]></value>
     <comment><![CDATA[The UNIX device name.]]></comment>
</key>





<key basename="interfaces/SymbolicName1/dhcphostname"
     type="string" mode="0664">

     <value><![CDATA[something.domain.com]]></value>
     <comment><![CDATA[The hostname we'll tell to the DHCP server, for dynDNS purposes.]]></comment>
</key>





<key basename="interfaces/SymbolicName1/ipv6init"
     type="string" mode="0664">

     <value><![CDATA[0]]></value>
     <comment><![CDATA[Weather this interface should be initialized with IPv6 too.]]></comment>
</key>





<key basename="interfaces/SymbolicName1/onboot"
     type="string" mode="0664">

     <value><![CDATA[1]]></value>
     <comment><![CDATA[1 for automatic activation on boot
0 for only manual]]></comment>
</key>





<key basename="interfaces/SymbolicName1/type"
     type="string" mode="0664">

     <value><![CDATA[ethernet]]></value>
     <comment><![CDATA[The phisical type of this network interface. Ethernet, Wireless, TokenRing, etc]]></comment>
</key>





<key basename="interfaces/SymbolicName1/usercontrol"
     type="string" mode="0664">

     <value><![CDATA[1]]></value>
     <comment><![CDATA[1 to let regular users control this interface
0 to be controled only by root]]></comment>
</key>





<key basename="interfaces/SymbolicName2"
     type="directory" mode="0775">
</key>





<key basename="nameserver"
     type="string" mode="0664">

     <value><![CDATA[ns1.domain.com, ns2.domain.com, ns1.organization.org]]></value>
     <comment><![CDATA[Comma separated list of name servers.]]></comment>
</key>





<key basename="search"
     type="string" mode="0664">

     <value><![CDATA[domain.com, sub1.domain.com, sub2.domain.com, domain2.com]]></value>
     <comment><![CDATA[Comma separated search domains.
Domains that will be tested together with a non FQDN host.]]></comment>
</key>





</keyset>
