<?xml version="1.0" encoding="UTF-8"?>

<!--

Subversion stuff

$Id$

-->

<!--

This specification-by-example defines an easier, more direct and more precise
way for applications to set aliases and env vars for a user session.

It will, in some ways, substitute the functionality of the files

	/etc/profile
	~/.profile
	~/.bashrc
	~/.bash_profile

Although on those files some can add code and some logic to define env vars,
this key schema is usefull when you just want to set environments in an
atomic way.

The /etc/profile.d/elektraenv.sh script loads the environments declared by
the keys in this schema.

The key hierarchy proposed (as examples) is:

Systemwide environments, as in /etc/profile:
	system/
	  env/
	    env1/
	      JAVA_HOME              = /opt/IBMJava2
	    env2/
	      PATH                   = $PATH:$JAVA_HOME/bin
	      LIBPATH                = $LIBPATH:$JAVA_HOME/lib
	    env3/
	      EDITOR                 = vi
	    alias/
	      ll                     = ls -l

User specific environment (loaded after system's), as in ~/.profile
	user/
	  env/
	    env1/
	    env2/
	      PATH                   = $PATH:~/bin
	      LIBPATH                = $LIBPATH:~/lib
	    env3/
	      PS1                    = \h:\w\$ 
	      EDITOR                 = kate
	    alias/
	      ls                     = ls -Fh -color=auto
	      ll                     = ls -l -Fh -color=auto
	      vi                     = gvim -x

Note that we have env1, env2 and env3 levels.
Thats because a script has a natural order for the things to happen, so we
can easily define $PATH using $JAVA_HOME, but after defining $JAVA_HOME.
Since there is no such natural order when accessing keys and values, the
elektraenv script will fetch env1, env2, env3 in this order, then envvars
can be defined dependent on previously defined other envvars, as
with $PATH depending on $JAVA_HOME.

In addition, the elektraenv script will fetch system/env keys before it
fetches user/env keys.

Avi Alkalay <avi@unix.sh>
Nov 2005

-->

<keyset xmlns="http://elektra.sourceforge.net"
        xmlns:xsi="http://www.w3.org/2001/XMLSchema-instance"
        xsi:schemaLocation="http://elektra.sourceforge.net elektra.xsd">

<!-- The systemwide environment and aliases -->
	<keyset parent="system/env/env1">
		<key basename="JAVA_HOME" value="/opt/IBMJava2"/>
	</keyset>


	<keyset parent="system/env/env2">
		<key basename="PATH">
			<value>$PATH:$JAVA_HOME/bin</value>
			<comment>Since we are under env2, and $JAVA_HOME was defined in env1, at this point, $JAVA_HOME is already set.</comment>
		</key>
		
		<key basename="LIBPATH" value="$LIBPATH:$JAVA_HOME/lib"/>
	</keyset>


	<keyset parent="system/env/env3">
		<key basename="EDITOR" value="vi"/>
	</keyset>


	<keyset parent="system/env/alias">
		<key basename="ll" value="ls -l"/>
	</keyset>




<!-- The user specific environment and aliases -->
	<keyset parent="user/env/env2">
		<key basename="PATH"    value="$PATH:~/bin"/>
		<key basename="LIBPATH" value="$LIBPATH:~/lib"/>
	</keyset>
	
	
	<keyset parent="user/env/env3">
		<key basename="PS1"    value="\h:\w\$ "/>
		<key basename="EDITOR" value="kate"/>
	</keyset>
		
		
	<keyset parent="user/env/alias">
		<key basename="ls" value="ls -Fh --color=tty"/>
		<key basename="ll" value="ls -l -Fh --color=tty"/>
		<key basename="vi" value="gvim -x"/>
	</keyset>

</keyset>